{
    "$schema": "../../package.schema.json",
    "name": "example-package",
    "displayName": "Example Package",
    "description": "Example Package description",
    "version": "^1.0.0",
    "dependencies": [
        {
            "name": "example-dependency-from-config-file1",
            "version": "^1.0.0"
        }
    ],
    "devDependencies": [
        {
            "name": "example-dev-dependency-from-config-file",
            "version": "^1.0.0"
        }
    ],
    "scripts": [{ "name": "example-script-from-config-file1", "command": "tsc --noEmit" }],
    "envVars": [{ "name": "EXAMPLE_ENV_VAR_FROM_CONFIG_FILE_1", "value": "pepe" }],
    "isUILibrary": false,
    "isIconLibrary": false,
    "canBeSharedPackage": true,
    "sharedPackageDefaultName": "example",
    "sharedPackageDefaultDescription": "example shared package description",
    "extraOptionsPrompts": [
        {
            "type": "checkbox",
            "name": "authentication-strategies",
            "message": "Which authentication strategy would you like to use?",
            "choices": [
                {
                    "name": "Email & Password - Traditional authentication",
                    "value": "email-password"
                },
                { "name": "Google - Social sign-in with Google", "value": "google" },
                { "name": "Facebook - Social sign-in with Facebook", "value": "facebook" }
            ],
            "default": "email-password"
        }
    ]
}
